{
  "schema_version": "atomic-authority-contract-v1",
  "chapter_id": "JIUCHUI:CH016",
  "protagonist_id": "PROTAGONIST_001",
  "contract_hash": "e479e40671ff599630fa6d6dce48d06bc98d1e0f0e874d1546a725feb4b925c5",
  "preflight_eligible": true,
  "hard_sources": [
    "canon",
    "frozen_mission",
    "power_authority"
  ],
  "artifact_provenance": [
    {
      "source": "canon",
      "artifact_id": "canon:native-e2e:jiuchui_ch16:1",
      "revision_sha256": "e77cf5bc14e1cde354f7597bfcc7113f74774294cbc612b43bc42ffb1b8af37a",
      "fact_ids": [
        "J16_CANON_WEDGE_POSSESSION",
        "J16_CANON_OUTER_PASS_USABLE"
      ]
    },
    {
      "source": "power_authority",
      "artifact_id": "power:native-e2e:jiuchui_ch16:1",
      "revision_sha256": "4e48a865ea69e5cf1e73ef0a71e97a9eef7eeb97070bf449baed8bf27f9d42ad",
      "fact_ids": [
        "J16_POWER_CLONE_LIMIT"
      ]
    },
    {
      "source": "frozen_mission",
      "artifact_id": "mission:JIUCHUI:CH016:director_structured_v1",
      "revision_sha256": "2ef89afa913cce68cc81f6768f6f0f678996b8159a69ba9632ac50c5f848680d",
      "fact_ids": [
        "MISSION_JIUCHUI_CH016_TRIGGER_EVENT_01",
        "MISSION_JIUCHUI_CH016_EVENT_DRIVER_01",
        "MISSION_JIUCHUI_CH016_PROTAGONIST_ACTION_01",
        "MISSION_JIUCHUI_CH016_PROTAGONIST_ACTION_02",
        "MISSION_JIUCHUI_CH016_WORLD_REACTION_01",
        "MISSION_JIUCHUI_CH016_DIRECT_RESULT_01",
        "MISSION_JIUCHUI_CH016_DIRECT_RESULT_02",
        "MISSION_JIUCHUI_CH016_STATE_CHANGE_01",
        "MISSION_JIUCHUI_CH016_STATE_CHANGE_02",
        "MISSION_JIUCHUI_CH016_STATE_CHANGE_03",
        "MISSION_JIUCHUI_CH016_ENDING_DRIVE_01"
      ]
    }
  ],
  "registry": {
    "schema_version": "entity-registry-v1",
    "chapter_id": "JIUCHUI:CH016",
    "protagonist_id": "PROTAGONIST_001",
    "entities": [
      {
        "entity_id": "CLONE_001",
        "kind": "manifestation",
        "display_name": "分身",
        "aliases": [
          "借身"
        ],
        "authority_refs": [
          "authority.entity.CLONE_001"
        ],
        "parent_entity_id": "PROTAGONIST_001"
      },
      {
        "entity_id": "ITEM_RETURN_TIDE_WEDGE_001",
        "kind": "item",
        "display_name": "回潮楔",
        "aliases": [
          "楔子"
        ],
        "authority_refs": [
          "authority.entity.ITEM_RETURN_TIDE_WEDGE_001"
        ],
        "parent_entity_id": ""
      },
      {
        "entity_id": "LOCATION_OBSERVATION_POINT_001",
        "kind": "location",
        "display_name": "旧关内侧观测点",
        "aliases": [
          "观测点"
        ],
        "authority_refs": [
          "authority.entity.LOCATION_OBSERVATION_POINT_001"
        ],
        "parent_entity_id": ""
      },
      {
        "entity_id": "LOCATION_OUTER_PASS_001",
        "kind": "location",
        "display_name": "旧关外层",
        "aliases": [
          "外层"
        ],
        "authority_refs": [
          "authority.entity.LOCATION_OUTER_PASS_001"
        ],
        "parent_entity_id": ""
      },
      {
        "entity_id": "LOCATION_SECOND_PRESSURE_NODE_001",
        "kind": "location",
        "display_name": "第二个潮压节点",
        "aliases": [],
        "authority_refs": [
          "authority.entity.LOCATION_SECOND_PRESSURE_NODE_001"
        ],
        "parent_entity_id": ""
      },
      {
        "entity_id": "MYSTERY_EARLY_TIDE_001",
        "kind": "mystery",
        "display_name": "地潮提前原因",
        "aliases": [],
        "authority_refs": [
          "authority.entity.MYSTERY_EARLY_TIDE_001"
        ],
        "parent_entity_id": ""
      },
      {
        "entity_id": "PROTAGONIST_001",
        "kind": "character",
        "display_name": "顾停舟",
        "aliases": [
          "他",
          "本体",
          "主角"
        ],
        "authority_refs": [
          "canon.protagonist"
        ],
        "parent_entity_id": ""
      },
      {
        "entity_id": "RESOURCE_WELLS_001",
        "kind": "resource",
        "display_name": "三座新潮井",
        "aliases": [
          "三座井"
        ],
        "authority_refs": [
          "authority.entity.RESOURCE_WELLS_001"
        ],
        "parent_entity_id": ""
      },
      {
        "entity_id": "ROUTE_GRAIN_001",
        "kind": "route",
        "display_name": "粮道",
        "aliases": [
          "粮路"
        ],
        "authority_refs": [
          "authority.entity.ROUTE_GRAIN_001"
        ],
        "parent_entity_id": ""
      },
      {
        "entity_id": "ROUTE_WATER_001",
        "kind": "route",
        "display_name": "砺骨部迁徙水路",
        "aliases": [
          "水路"
        ],
        "authority_refs": [
          "authority.entity.ROUTE_WATER_001"
        ],
        "parent_entity_id": ""
      }
    ]
  },
  "facts": [
    {
      "fact_id": "J16_CANON_OUTER_PASS_USABLE",
      "slot_id": "state:LOCATION_OUTER_PASS_001",
      "source": "canon",
      "source_ref": "canon:native-e2e:jiuchui_ch16:1#fact:2",
      "kind": "state_transition",
      "mode": "must_hold",
      "phase": "pre_chapter",
      "actor_id": "PROTAGONIST_001",
      "action_id": "outer_pass_remains_usable",
      "object_ids": [
        "LOCATION_OUTER_PASS_001"
      ],
      "counterparty_ids": [],
      "from_state": "",
      "to_state": "usable",
      "value": null,
      "terminal": false,
      "condition_fact_ids": [],
      "depends_on_fact_ids": [],
      "condition_slots": [],
      "depends_on_slots": [],
      "metadata": {}
    },
    {
      "fact_id": "J16_CANON_WEDGE_POSSESSION",
      "slot_id": "ownership:ITEM_RETURN_TIDE_WEDGE_001",
      "source": "canon",
      "source_ref": "canon:native-e2e:jiuchui_ch16:1#fact:1",
      "kind": "ownership_transition",
      "mode": "must_hold",
      "phase": "pre_chapter",
      "actor_id": "PROTAGONIST_001",
      "action_id": "possess",
      "object_ids": [
        "ITEM_RETURN_TIDE_WEDGE_001"
      ],
      "counterparty_ids": [],
      "from_state": "",
      "to_state": "possessed_by_protagonist",
      "value": null,
      "terminal": false,
      "condition_fact_ids": [],
      "depends_on_fact_ids": [],
      "condition_slots": [],
      "depends_on_slots": [],
      "metadata": {}
    },
    {
      "fact_id": "J16_POWER_CLONE_LIMIT",
      "slot_id": "ability:CLONE_001:carried_power",
      "source": "power_authority",
      "source_ref": "power:native-e2e:jiuchui_ch16:1#fact:1",
      "kind": "ability_boundary",
      "mode": "must_hold",
      "phase": "pre_chapter",
      "actor_id": "CLONE_001",
      "action_id": "carry_stabilize_only",
      "object_ids": [
        "ITEM_RETURN_TIDE_WEDGE_001"
      ],
      "counterparty_ids": [],
      "from_state": "",
      "to_state": "",
      "value": {
        "allowed": [
          "stabilize"
        ],
        "full_body_power": false
      },
      "terminal": false,
      "condition_fact_ids": [],
      "depends_on_fact_ids": [],
      "condition_slots": [],
      "depends_on_slots": [],
      "metadata": {}
    },
    {
      "fact_id": "MISSION_JIUCHUI_CH016_DIRECT_RESULT_01",
      "slot_id": "result:JIUCHUI:CH016:01",
      "source": "frozen_mission",
      "source_ref": "mission:JIUCHUI:CH016:director_structured_v1#fact:6",
      "kind": "direct_result",
      "mode": "terminal",
      "phase": "chapter_end",
      "actor_id": "PROTAGONIST_001",
      "action_id": "preserve_resources",
      "object_ids": [
        "ROUTE_GRAIN_001",
        "RESOURCE_WELLS_001",
        "ROUTE_WATER_001"
      ],
      "counterparty_ids": [],
      "from_state": "",
      "to_state": "preserved",
      "value": null,
      "terminal": true,
      "condition_fact_ids": [],
      "depends_on_fact_ids": [],
      "condition_slots": [],
      "depends_on_slots": [],
      "metadata": {}
    },
    {
      "fact_id": "MISSION_JIUCHUI_CH016_DIRECT_RESULT_02",
      "slot_id": "ownership:ITEM_RETURN_TIDE_WEDGE_001",
      "source": "frozen_mission",
      "source_ref": "mission:JIUCHUI:CH016:director_structured_v1#fact:7",
      "kind": "ownership_transition",
      "mode": "terminal",
      "phase": "chapter_end",
      "actor_id": "PROTAGONIST_001",
      "action_id": "retain_possession",
      "object_ids": [
        "ITEM_RETURN_TIDE_WEDGE_001"
      ],
      "counterparty_ids": [],
      "from_state": "possessed_by_protagonist",
      "to_state": "possessed_by_protagonist",
      "value": null,
      "terminal": true,
      "condition_fact_ids": [],
      "depends_on_fact_ids": [],
      "condition_slots": [],
      "depends_on_slots": [],
      "metadata": {}
    },
    {
      "fact_id": "MISSION_JIUCHUI_CH016_ENDING_DRIVE_01",
      "slot_id": "ending:JIUCHUI:CH016:01",
      "source": "frozen_mission",
      "source_ref": "mission:JIUCHUI:CH016:director_structured_v1#fact:11",
      "kind": "ending",
      "mode": "terminal",
      "phase": "chapter_end",
      "actor_id": "PROTAGONIST_001",
      "action_id": "enter_observation_point",
      "object_ids": [
        "LOCATION_OBSERVATION_POINT_001"
      ],
      "counterparty_ids": [],
      "from_state": "",
      "to_state": "",
      "value": null,
      "terminal": true,
      "condition_fact_ids": [],
      "depends_on_fact_ids": [],
      "condition_slots": [],
      "depends_on_slots": [],
      "metadata": {}
    },
    {
      "fact_id": "MISSION_JIUCHUI_CH016_EVENT_DRIVER_01",
      "slot_id": "event:JIUCHUI:CH016:event_driver:01",
      "source": "frozen_mission",
      "source_ref": "mission:JIUCHUI:CH016:director_structured_v1#fact:2",
      "kind": "action",
      "mode": "must_hold",
      "phase": "during_chapter",
      "actor_id": "PROTAGONIST_001",
      "action_id": "choose_resource_tradeoff",
      "object_ids": [
        "RESOURCE_WELLS_001",
        "ROUTE_GRAIN_001",
        "ROUTE_WATER_001"
      ],
      "counterparty_ids": [],
      "from_state": "",
      "to_state": "",
      "value": null,
      "terminal": false,
      "condition_fact_ids": [],
      "depends_on_fact_ids": [],